,review_id,rating,text,review_url,user_id,PROPERTYTYPE,Store_name,SOURCE,DATE_SCRAPED
0,S8R-u83HWJm8jBYCGCeqng,5,"Amazing customer service, works with you on prices. Have people helping you find everything so you can get finished quickly and efficiently. Also, they...",https://www.yelp.com/biz/quick-tobbaco-wholesale-los-angeles?adjust_creative=oAYGHKSZvK_Az-ZQ4UyTGQ&hrid=S8R-u83HWJm8jBYCGCeqng&utm_campaign=yelp_api_v3&utm_medium=api_v3_business_reviews&utm_source=oAYGHKSZvK_Az-ZQ4UyTGQ,gN0fP2Mdgn_EssRtWGrxDw,tobacco,Quick Tobbaco Wholesale,yelp,01-31-2020
0,B2f69ozHdTHiYsE5PSPK7Q,5,Cashier was very helpful and friendly! Really gave me a lot of information I was curious about and had great prices!,https://www.yelp.com/biz/king-chief-tobacco-los-angeles-3?adjust_creative=oAYGHKSZvK_Az-ZQ4UyTGQ&hrid=B2f69ozHdTHiYsE5PSPK7Q&utm_campaign=yelp_api_v3&utm_medium=api_v3_business_reviews&utm_source=oAYGHKSZvK_Az-ZQ4UyTGQ,h6KjoZQl__PfRYh_bSh2vw,tobacco,King Chief Tobacco,yelp,01-31-2020
0,VaeVAzAnm0LvLCyv_uMp8w,5,"The owner is super nice and friendly.
The place is clean, hipster and he plays real good music lol. 
And as far as prices go, he's about $2 cheaper than the...",https://www.yelp.com/biz/sharifs-smoke-shop-inglewood?adjust_creative=oAYGHKSZvK_Az-ZQ4UyTGQ&hrid=VaeVAzAnm0LvLCyv_uMp8w&utm_campaign=yelp_api_v3&utm_medium=api_v3_business_reviews&utm_source=oAYGHKSZvK_Az-ZQ4UyTGQ,4yOyDJlk9g3YyydopY5l7w,tobacco,Sharif's Smoke Shop,yelp,01-31-2020
1,6siLax3EsccCaL_34Ik9Dg,5,I don't smoke but the shop smelled great with that tobacco aroma in the air. This smoke shop looks like a candy store for the addicted nicotine users. I saw...,https://www.yelp.com/biz/sharifs-smoke-shop-inglewood?adjust_creative=oAYGHKSZvK_Az-ZQ4UyTGQ&hrid=6siLax3EsccCaL_34Ik9Dg&utm_campaign=yelp_api_v3&utm_medium=api_v3_business_reviews&utm_source=oAYGHKSZvK_Az-ZQ4UyTGQ,uIBhZTxEdOw1FRVpSJ45mQ,tobacco,Sharif's Smoke Shop,yelp,01-31-2020
2,qaMO-bl6jcYchytJYLxjYg,1,Doooo NOT come here they are CLOSED he does not update the hours or when the store is closed. I've been to this store twice in the past month and both times...,https://www.yelp.com/biz/sharifs-smoke-shop-inglewood?adjust_creative=oAYGHKSZvK_Az-ZQ4UyTGQ&hrid=qaMO-bl6jcYchytJYLxjYg&utm_campaign=yelp_api_v3&utm_medium=api_v3_business_reviews&utm_source=oAYGHKSZvK_Az-ZQ4UyTGQ,fbrj7ncHliUh-XYLYTl4_g,tobacco,Sharif's Smoke Shop,yelp,01-31-2020
0,bmBN8k04syAkGrf32MJwyA,5,"Charlie's smoke shop is the best. 

I love going there to get my smokes 
Nice people 
And good stuff like the electronic smokes 
And the hookah electronic...",https://www.yelp.com/biz/charlies-smoke-shop-los-angeles?adjust_creative=oAYGHKSZvK_Az-ZQ4UyTGQ&hrid=bmBN8k04syAkGrf32MJwyA&utm_campaign=yelp_api_v3&utm_medium=api_v3_business_reviews&utm_source=oAYGHKSZvK_Az-ZQ4UyTGQ,6L7d9BwyB7FNjymgjFDvrA,tobacco,Charlie's Smoke Shop,yelp,01-31-2020
0,0AuskCWiU5VXbT8rKjV6jQ,5,"Great customer service, good spot for buying your cig  , wraps and e.cig ! Amazing prices willing to negotiate .
Everything you need for your household and...",https://www.yelp.com/biz/tobacco-zone-and-mini-mart-los-angeles?adjust_creative=oAYGHKSZvK_Az-ZQ4UyTGQ&hrid=0AuskCWiU5VXbT8rKjV6jQ&utm_campaign=yelp_api_v3&utm_medium=api_v3_business_reviews&utm_source=oAYGHKSZvK_Az-ZQ4UyTGQ,ePYSHWBNvnx33Dpo4BVQcQ,tobacco,Tobacco Zone & Mini Mart,yelp,01-31-2020
0,G33SxTQg90o1PCi7vhjlkg,5,My FAV place to kick back and have a good time. The owners are awesome. They have a great selection and amazing customer service. Always great conversation.,https://www.yelp.com/biz/la-lounge-inglewood-2?adjust_creative=oAYGHKSZvK_Az-ZQ4UyTGQ&hrid=G33SxTQg90o1PCi7vhjlkg&utm_campaign=yelp_api_v3&utm_medium=api_v3_business_reviews&utm_source=oAYGHKSZvK_Az-ZQ4UyTGQ,__zupGaoeOiTV8Qo5K_F8A,tobacco,LA Lounge,yelp,01-31-2020
1,iXLgsFi3XAC00yzd2u_a7Q,5,"Great atmosphere!! Great people; everyone is really friendly.  TVs, music, pool, dominoes, food, and a great selection of cigars. Aaron and Larry, the...",https://www.yelp.com/biz/la-lounge-inglewood-2?adjust_creative=oAYGHKSZvK_Az-ZQ4UyTGQ&hrid=iXLgsFi3XAC00yzd2u_a7Q&utm_campaign=yelp_api_v3&utm_medium=api_v3_business_reviews&utm_source=oAYGHKSZvK_Az-ZQ4UyTGQ,8d_gar2UVIYGbQnA9PxMDw,tobacco,LA Lounge,yelp,01-31-2020
2,sxUc4IEaocKGxbqRlDsO5w,5,"Me and my girls came out and had a great time.   Nice atmosphere, good music great vibes.   They had a good selection of cigars to choose from. The staff...",https://www.yelp.com/biz/la-lounge-inglewood-2?adjust_creative=oAYGHKSZvK_Az-ZQ4UyTGQ&hrid=sxUc4IEaocKGxbqRlDsO5w&utm_campaign=yelp_api_v3&utm_medium=api_v3_business_reviews&utm_source=oAYGHKSZvK_Az-ZQ4UyTGQ,lg_yo1ZblfSBd31ukO_C_A,tobacco,LA Lounge,yelp,01-31-2020
0,SG44bYb8jA55xoyb9512nA,5,"I absolutely love this shop!!! I come in all the time to purchase my hookah flavors and they ALWAYS have what I want. Not only that, but there variety of...",https://www.yelp.com/biz/i-smoke-4-less-los-angeles-3?adjust_creative=oAYGHKSZvK_Az-ZQ4UyTGQ&hrid=SG44bYb8jA55xoyb9512nA&utm_campaign=yelp_api_v3&utm_medium=api_v3_business_reviews&utm_source=oAYGHKSZvK_Az-ZQ4UyTGQ,164s2ovUPdHRYGgQ6DEhlg,tobacco,I smoke 4 less,yelp,01-31-2020
1,xE6jhFWNRVmUbgqaYnZvyA,2,I tried searching the place. The address given is way off and they were closed so wrong hours listed. Can't the inside of the place because never got to go in,https://www.yelp.com/biz/i-smoke-4-less-los-angeles-3?adjust_creative=oAYGHKSZvK_Az-ZQ4UyTGQ&hrid=xE6jhFWNRVmUbgqaYnZvyA&utm_campaign=yelp_api_v3&utm_medium=api_v3_business_reviews&utm_source=oAYGHKSZvK_Az-ZQ4UyTGQ,urMqooTcZI4EwIG_qC5UPA,tobacco,I smoke 4 less,yelp,01-31-2020
2,bTvE-SwlgL72NbqpZuhnYw,5,"Great place to buy your ejuice or ecigarettes! They are affordable. Ozzy even gave me a discount :) I'm a new vaper and kindy shy asking questions, but he's...",https://www.yelp.com/biz/i-smoke-4-less-los-angeles-3?adjust_creative=oAYGHKSZvK_Az-ZQ4UyTGQ&hrid=bTvE-SwlgL72NbqpZuhnYw&utm_campaign=yelp_api_v3&utm_medium=api_v3_business_reviews&utm_source=oAYGHKSZvK_Az-ZQ4UyTGQ,6ECLpF8b2ZRtUit5SdWRQQ,tobacco,I smoke 4 less,yelp,01-31-2020
0,EvgDU2S7oFHkxaG7ADBQCA,5,"I like the store because it's so clean and convenient. They have a great variety of blunts, cigarettes, cigars, vape juices, pipes, incenses, and also most...",https://www.yelp.com/biz/tobacco-and-mini-mart-inglewood?adjust_creative=oAYGHKSZvK_Az-ZQ4UyTGQ&hrid=EvgDU2S7oFHkxaG7ADBQCA&utm_campaign=yelp_api_v3&utm_medium=api_v3_business_reviews&utm_source=oAYGHKSZvK_Az-ZQ4UyTGQ,lsOBtUR4uYxL7OBW70LDbg,tobacco,Tobacco And Mini Mart,yelp,01-31-2020
0,dPiiM3LhFeqxeQ83ra6vhw,5,"Awesome shop!
Great variety of products! 
Overall an amazing place I have been going there for quite some time now!",https://www.yelp.com/biz/dream-center-smoke-shop-los-angeles-4?adjust_creative=oAYGHKSZvK_Az-ZQ4UyTGQ&hrid=dPiiM3LhFeqxeQ83ra6vhw&utm_campaign=yelp_api_v3&utm_medium=api_v3_business_reviews&utm_source=oAYGHKSZvK_Az-ZQ4UyTGQ,mIhtNXuKOnhucLjW3oDXZA,tobacco,Dream Center Smoke Shop,yelp,01-31-2020
1,14TOk1nTV6GgcRpsEqiOLg,5,"I stopped by this place on my way to a meeting and they definitely have a great selection of tobacco, the cashier behind the register was very helpful with...",https://www.yelp.com/biz/dream-center-smoke-shop-los-angeles-4?adjust_creative=oAYGHKSZvK_Az-ZQ4UyTGQ&hrid=14TOk1nTV6GgcRpsEqiOLg&utm_campaign=yelp_api_v3&utm_medium=api_v3_business_reviews&utm_source=oAYGHKSZvK_Az-ZQ4UyTGQ,BYNlmBb1kXidu5MPr7to1g,tobacco,Dream Center Smoke Shop,yelp,01-31-2020
2,EFoAU7jGUDvhS1qtTU4PAg,5,"I'm not sure why this place has low ratings. I'm female, seemingly Caucasian (fools), and went in alone. From the moment I got there, to asking what I was...",https://www.yelp.com/biz/dream-center-smoke-shop-los-angeles-4?adjust_creative=oAYGHKSZvK_Az-ZQ4UyTGQ&hrid=EFoAU7jGUDvhS1qtTU4PAg&utm_campaign=yelp_api_v3&utm_medium=api_v3_business_reviews&utm_source=oAYGHKSZvK_Az-ZQ4UyTGQ,z9ArLLAEwv4nwhlf7UMwJw,tobacco,Dream Center Smoke Shop,yelp,01-31-2020
0,pyGSz3zCRd5JHKwHEp979g,5,"Girl (I didn't get her name)at the front desk is awesome!!Great service, great prices, quality products and definitely a new favorite smoke stop in Vernon!...",https://www.yelp.com/biz/og-tobacco-vernon?adjust_creative=oAYGHKSZvK_Az-ZQ4UyTGQ&hrid=pyGSz3zCRd5JHKwHEp979g&utm_campaign=yelp_api_v3&utm_medium=api_v3_business_reviews&utm_source=oAYGHKSZvK_Az-ZQ4UyTGQ,aSFsX4XO73mF-wNa27X8eA,tobacco,Og Tobacco,yelp,01-31-2020
1,rElQ32YNbszX6X4pEdQz8Q,5,"This shop is only a few blocks from my place and they have basically everything you need from cigarettes, cigars, wraps, glass, etc
 They also have a good...",https://www.yelp.com/biz/og-tobacco-vernon?adjust_creative=oAYGHKSZvK_Az-ZQ4UyTGQ&hrid=rElQ32YNbszX6X4pEdQz8Q&utm_campaign=yelp_api_v3&utm_medium=api_v3_business_reviews&utm_source=oAYGHKSZvK_Az-ZQ4UyTGQ,uRS0PMpOiQLUBUaQ2bDlLQ,tobacco,Og Tobacco,yelp,01-31-2020
2,WJ8se6uLGZBPdweZzYx3gw,1,"0 shits given about customers. Barely any selection of anything. Can't even look at the customer when talking and when asked a question, the response is in...",https://www.yelp.com/biz/og-tobacco-vernon?adjust_creative=oAYGHKSZvK_Az-ZQ4UyTGQ&hrid=WJ8se6uLGZBPdweZzYx3gw&utm_campaign=yelp_api_v3&utm_medium=api_v3_business_reviews&utm_source=oAYGHKSZvK_Az-ZQ4UyTGQ,trZjVlLJTiCfuj3pEi4FpQ,tobacco,Og Tobacco,yelp,01-31-2020
0,TFdxbn2QbatgjJAV8TbFaQ,5,"Del Rey Smoke Stacks has reasonable prices and the service is super friendly. The store is super clean and always stocked with what you might need.

Parking...",https://www.yelp.com/biz/del-rey-smoke-stacks-los-angeles?adjust_creative=oAYGHKSZvK_Az-ZQ4UyTGQ&hrid=TFdxbn2QbatgjJAV8TbFaQ&utm_campaign=yelp_api_v3&utm_medium=api_v3_business_reviews&utm_source=oAYGHKSZvK_Az-ZQ4UyTGQ,ktUxDtUAtoc3fgCopW9LLw,tobacco,Del Rey Smoke Stacks,yelp,01-31-2020
1,p9Iy3y_rJMzJooSutBO0qA,2,I've never been to a smoke shop where they are not only completely not interested in helping you but they seem to have absolutely no knowledge about their...,https://www.yelp.com/biz/del-rey-smoke-stacks-los-angeles?adjust_creative=oAYGHKSZvK_Az-ZQ4UyTGQ&hrid=p9Iy3y_rJMzJooSutBO0qA&utm_campaign=yelp_api_v3&utm_medium=api_v3_business_reviews&utm_source=oAYGHKSZvK_Az-ZQ4UyTGQ,QP0U8YPutzhqoxQYDr3y4w,tobacco,Del Rey Smoke Stacks,yelp,01-31-2020
2,x_KzTA8YrEY-xOIC6HI6_g,5,I just got my  first hookah and the cashier or maybe even owner's son was so helpful. They have great quality products! 10/10 recommend,https://www.yelp.com/biz/del-rey-smoke-stacks-los-angeles?adjust_creative=oAYGHKSZvK_Az-ZQ4UyTGQ&hrid=x_KzTA8YrEY-xOIC6HI6_g&utm_campaign=yelp_api_v3&utm_medium=api_v3_business_reviews&utm_source=oAYGHKSZvK_Az-ZQ4UyTGQ,TolJadRMMk6CZFjhKrvljg,tobacco,Del Rey Smoke Stacks,yelp,01-31-2020
0,pajgrFvCtJKzxLR7sxLrjQ,5,"Tobacco Plus is a Great part of the West L.A. Community.
There is a Marvelous Selection with Something for Everybody.
A Truly 5 Star Establishment.",https://www.yelp.com/biz/tobacco-plus-culver-city?adjust_creative=oAYGHKSZvK_Az-ZQ4UyTGQ&hrid=pajgrFvCtJKzxLR7sxLrjQ&utm_campaign=yelp_api_v3&utm_medium=api_v3_business_reviews&utm_source=oAYGHKSZvK_Az-ZQ4UyTGQ,iaeCYWvDwdEnCCRo4_3IfQ,tobacco,Tobacco Plus,yelp,01-31-2020
1,a7CsdBiyT01BF_3FqRbJHQ,1,I should've called to check if the shop was open. Alas the door was closed 3PM Saturday.,https://www.yelp.com/biz/tobacco-plus-culver-city?adjust_creative=oAYGHKSZvK_Az-ZQ4UyTGQ&hrid=a7CsdBiyT01BF_3FqRbJHQ&utm_campaign=yelp_api_v3&utm_medium=api_v3_business_reviews&utm_source=oAYGHKSZvK_Az-ZQ4UyTGQ,hMhAQgUl81J9_o1v-RyCsg,tobacco,Tobacco Plus,yelp,01-31-2020
2,gToLlfU8Qr819ZdB6pyaTw,1,"Owner is rude, constantly asking me what i'm looking for, told him i'm getting pods, but I wanna look around for bit. He continues to harass me asking me...",https://www.yelp.com/biz/tobacco-plus-culver-city?adjust_creative=oAYGHKSZvK_Az-ZQ4UyTGQ&hrid=gToLlfU8Qr819ZdB6pyaTw&utm_campaign=yelp_api_v3&utm_medium=api_v3_business_reviews&utm_source=oAYGHKSZvK_Az-ZQ4UyTGQ,eNwNB5uvvSg9DUHNOFqiZg,tobacco,Tobacco Plus,yelp,01-31-2020
0,RzoAM_AIelX_E27iq8KMCw,5,HAHAHAHAHa i am only writing this review because I have been coming here for 4YEARS and the customer service is great the prices are perfect and they have...,https://www.yelp.com/biz/santa-monica-tobacco-santa-monica?adjust_creative=oAYGHKSZvK_Az-ZQ4UyTGQ&hrid=RzoAM_AIelX_E27iq8KMCw&utm_campaign=yelp_api_v3&utm_medium=api_v3_business_reviews&utm_source=oAYGHKSZvK_Az-ZQ4UyTGQ,n-Zx1lDduLERE4wRjYskaQ,tobacco,Santa Monica Tobacco,yelp,01-31-2020
1,VAQZ2EAyA9NTrrFHmh8DNQ,1,The employees are excellent and friendly. The humidor is very unimpressive.  Many of the cigars don't even have prices on them which is really annoying....,https://www.yelp.com/biz/santa-monica-tobacco-santa-monica?adjust_creative=oAYGHKSZvK_Az-ZQ4UyTGQ&hrid=VAQZ2EAyA9NTrrFHmh8DNQ&utm_campaign=yelp_api_v3&utm_medium=api_v3_business_reviews&utm_source=oAYGHKSZvK_Az-ZQ4UyTGQ,yJS6vTEgEa-dN2rdyznCow,tobacco,Santa Monica Tobacco,yelp,01-31-2020
2,9yDyJyg6UROI2xk_YfuHSQ,1,Person working the store was so rude to me. Wouldnt even look up to answer my questions. Came from out of town and never experienced anything like this from...,https://www.yelp.com/biz/santa-monica-tobacco-santa-monica?adjust_creative=oAYGHKSZvK_Az-ZQ4UyTGQ&hrid=9yDyJyg6UROI2xk_YfuHSQ&utm_campaign=yelp_api_v3&utm_medium=api_v3_business_reviews&utm_source=oAYGHKSZvK_Az-ZQ4UyTGQ,-MJqHmggqz_tScuZtCIo2A,tobacco,Santa Monica Tobacco,yelp,01-31-2020
0,R4KFubJO1U76BMsivGwlEA,5,This is the only store in all of LA County that has a decent selection of pipes and pipe tobacco. The owner was super friendly and knowledgeable and even...,https://www.yelp.com/biz/tobacco-trader-and-glass-los-angeles-3?adjust_creative=oAYGHKSZvK_Az-ZQ4UyTGQ&hrid=R4KFubJO1U76BMsivGwlEA&utm_campaign=yelp_api_v3&utm_medium=api_v3_business_reviews&utm_source=oAYGHKSZvK_Az-ZQ4UyTGQ,XLITi3ZbbqvaP5ncNGHHrA,tobacco,Tobacco Trader and Glass,yelp,01-31-2020
1,-xiFB_KOLCQX4x6PgCK22A,5,"Mark and Manny are very helpful and keep a strong inventory of cigars, pipe tobacco, CBD, and other products. Prices are very competitive, and you won't...",https://www.yelp.com/biz/tobacco-trader-and-glass-los-angeles-3?adjust_creative=oAYGHKSZvK_Az-ZQ4UyTGQ&hrid=-xiFB_KOLCQX4x6PgCK22A&utm_campaign=yelp_api_v3&utm_medium=api_v3_business_reviews&utm_source=oAYGHKSZvK_Az-ZQ4UyTGQ,8DfGKOcHjBO9nQ30DXEHkw,tobacco,Tobacco Trader and Glass,yelp,01-31-2020
2,H2F6DvaE066k_Xmu3_wjZA,5,Best cigar shop! Great selection. Easy parking (but best to avoid lunch hour bc adjacent businesses make traffic a little busy). Really helpful & kind...,https://www.yelp.com/biz/tobacco-trader-and-glass-los-angeles-3?adjust_creative=oAYGHKSZvK_Az-ZQ4UyTGQ&hrid=H2F6DvaE066k_Xmu3_wjZA&utm_campaign=yelp_api_v3&utm_medium=api_v3_business_reviews&utm_source=oAYGHKSZvK_Az-ZQ4UyTGQ,Aa5qSHjZRsLi5YJ4YnuN_Q,tobacco,Tobacco Trader and Glass,yelp,01-31-2020
0,4WNSvKe_neXNv6UPFKC3bQ,5,Ozee and David have a great selection and will hook you up with a good flavor. It's nice to have a good place near by that isn't overcharging like many of...,https://www.yelp.com/biz/i-smoke-4-less-los-angeles-4?adjust_creative=oAYGHKSZvK_Az-ZQ4UyTGQ&hrid=4WNSvKe_neXNv6UPFKC3bQ&utm_campaign=yelp_api_v3&utm_medium=api_v3_business_reviews&utm_source=oAYGHKSZvK_Az-ZQ4UyTGQ,n121qxhKA-7iYqaCqlfoOA,tobacco,I Smoke 4 Less,yelp,01-31-2020
1,WwzkMGQ6H1iqP32P-Ebj8w,5,"Azi , Daud, Ahmed, and David are exceptional. They carry a variety of juices and accessories for all of your vaping needs (at a reasonable price). They also...",https://www.yelp.com/biz/i-smoke-4-less-los-angeles-4?adjust_creative=oAYGHKSZvK_Az-ZQ4UyTGQ&hrid=WwzkMGQ6H1iqP32P-Ebj8w&utm_campaign=yelp_api_v3&utm_medium=api_v3_business_reviews&utm_source=oAYGHKSZvK_Az-ZQ4UyTGQ,4BbBngIRETEuXAyVLN0_zg,tobacco,I Smoke 4 Less,yelp,01-31-2020
2,m4lXQO_rWDU6B3frVkDUyQ,1,Not at the listed location. Drive around followed direct directions from my maps and it took me to some sketchy apartments,https://www.yelp.com/biz/i-smoke-4-less-los-angeles-4?adjust_creative=oAYGHKSZvK_Az-ZQ4UyTGQ&hrid=m4lXQO_rWDU6B3frVkDUyQ&utm_campaign=yelp_api_v3&utm_medium=api_v3_business_reviews&utm_source=oAYGHKSZvK_Az-ZQ4UyTGQ,IuFuaub_RQ6-jx7O3EgiBg,tobacco,I Smoke 4 Less,yelp,01-31-2020
0,jDTomLXW-KoZZGEO0E0fjg,5,"Great Spot!! Great Owner!! Great deals!! Friendly staff with plenty of inventory!  I will Always make American Tobacco my ""Go To"" spot when I'm in Gardena!",https://www.yelp.com/biz/american-tobbacco-gardena?adjust_creative=oAYGHKSZvK_Az-ZQ4UyTGQ&hrid=jDTomLXW-KoZZGEO0E0fjg&utm_campaign=yelp_api_v3&utm_medium=api_v3_business_reviews&utm_source=oAYGHKSZvK_Az-ZQ4UyTGQ,P2AutUw3LYGYky302S0YkQ,tobacco,American Tobbacco,yelp,01-31-2020
1,TsWIu9LHd4jO9ds8jLt6jg,5,Best Smoke Shop in town! Owner is real cool and the Pretty Lady makes everyone smile! Good prices & selection for gifts too!,https://www.yelp.com/biz/american-tobbacco-gardena?adjust_creative=oAYGHKSZvK_Az-ZQ4UyTGQ&hrid=TsWIu9LHd4jO9ds8jLt6jg&utm_campaign=yelp_api_v3&utm_medium=api_v3_business_reviews&utm_source=oAYGHKSZvK_Az-ZQ4UyTGQ,u36gQOtPHaRfuXDCyUUPMw,tobacco,American Tobbacco,yelp,01-31-2020
2,XUACtAEWu4IzwizPNGaO9w,5,"Excellent first time experience. Guy at the counter gave me a good deal on some decent cigars and even threw in a cigar cutter.
I didn't explore much but...",https://www.yelp.com/biz/american-tobbacco-gardena?adjust_creative=oAYGHKSZvK_Az-ZQ4UyTGQ&hrid=XUACtAEWu4IzwizPNGaO9w&utm_campaign=yelp_api_v3&utm_medium=api_v3_business_reviews&utm_source=oAYGHKSZvK_Az-ZQ4UyTGQ,BDT1eHpjOnbJPQjpBhtGkQ,tobacco,American Tobbacco,yelp,01-31-2020
0,A334GtcC8WqarfV6K6movg,5,Always an amazing and fast experience here they have great deals and sell stiiizy batteries!,https://www.yelp.com/biz/vip-tobacco-and-cigars-gardena?adjust_creative=oAYGHKSZvK_Az-ZQ4UyTGQ&hrid=A334GtcC8WqarfV6K6movg&utm_campaign=yelp_api_v3&utm_medium=api_v3_business_reviews&utm_source=oAYGHKSZvK_Az-ZQ4UyTGQ,lgLc8p01np4TbMxz13Y9dw,tobacco,VIP Tobacco & Cigars,yelp,01-31-2020
1,tJQcO6OWBGjSQOJ7_0jRzQ,5,Love this place! Always good prices and a large variety of items to chose from..will always go here for what I need and recommending to people for sure!...,https://www.yelp.com/biz/vip-tobacco-and-cigars-gardena?adjust_creative=oAYGHKSZvK_Az-ZQ4UyTGQ&hrid=tJQcO6OWBGjSQOJ7_0jRzQ&utm_campaign=yelp_api_v3&utm_medium=api_v3_business_reviews&utm_source=oAYGHKSZvK_Az-ZQ4UyTGQ,vJ9swBvFLL7CAtF9DQLWQw,tobacco,VIP Tobacco & Cigars,yelp,01-31-2020
2,dRcxHYGl0fegs8l4HTAwmg,4,Relatively new to the vaping scene and wanted a friendly neighborhood spot I could call my own for all my vaping needs. Got off work at 8am and got on yelp...,https://www.yelp.com/biz/vip-tobacco-and-cigars-gardena?adjust_creative=oAYGHKSZvK_Az-ZQ4UyTGQ&hrid=dRcxHYGl0fegs8l4HTAwmg&utm_campaign=yelp_api_v3&utm_medium=api_v3_business_reviews&utm_source=oAYGHKSZvK_Az-ZQ4UyTGQ,vMqGMfcEXTZUOGQ9fgfJUg,tobacco,VIP Tobacco & Cigars,yelp,01-31-2020
0,4oJ54m_qMqvyQAuoqlhEhg,5,"A hidden oasis that takes you away from the hustle & bustle of the modern world; all within a reasonable distance from your home. I'll take it.

There are...",https://www.yelp.com/biz/culver-city-park-culver-city?adjust_creative=oAYGHKSZvK_Az-ZQ4UyTGQ&hrid=4oJ54m_qMqvyQAuoqlhEhg&utm_campaign=yelp_api_v3&utm_medium=api_v3_business_reviews&utm_source=oAYGHKSZvK_Az-ZQ4UyTGQ,BC1Fvp_QFU5ZfBfWKhdkdQ,park,Culver City Park,yelp,01-31-2020
1,NQjkoO9DW7tnylEhnHpi5A,5,This was such a great park to visit on my trip to Los Angeles from the East coast. I love the doggy prints on the way to the dog park. When I went it had...,https://www.yelp.com/biz/culver-city-park-culver-city?adjust_creative=oAYGHKSZvK_Az-ZQ4UyTGQ&hrid=NQjkoO9DW7tnylEhnHpi5A&utm_campaign=yelp_api_v3&utm_medium=api_v3_business_reviews&utm_source=oAYGHKSZvK_Az-ZQ4UyTGQ,4ZDFVcRv6fDn9_kc3SQ5Cw,park,Culver City Park,yelp,01-31-2020
2,fclOa8PKaH6G0vPgkQFErg,4,"Decent park, went there once for Skateside Skatefest. Nothing spectacular, but parking was available on the Duquesne Ave",https://www.yelp.com/biz/culver-city-park-culver-city?adjust_creative=oAYGHKSZvK_Az-ZQ4UyTGQ&hrid=fclOa8PKaH6G0vPgkQFErg&utm_campaign=yelp_api_v3&utm_medium=api_v3_business_reviews&utm_source=oAYGHKSZvK_Az-ZQ4UyTGQ,JEIuVtrpa-0rMhSZYbcdQA,park,Culver City Park,yelp,01-31-2020
0,ZCUxydNWeABsDcLqXP-yew,5,By far my favorite park because of the view that it offers. Whether it is to have a picnic on the grass by bench with the view or if you're here at...,https://www.yelp.com/biz/vista-hermosa-natural-park-los-angeles?adjust_creative=oAYGHKSZvK_Az-ZQ4UyTGQ&hrid=ZCUxydNWeABsDcLqXP-yew&utm_campaign=yelp_api_v3&utm_medium=api_v3_business_reviews&utm_source=oAYGHKSZvK_Az-ZQ4UyTGQ,hBUQIq2jDHrJA6zjhzRK8Q,park,Vista Hermosa Natural Park,yelp,01-31-2020
1,Jp8Cdt6SkIZz0z_qof858Q,1,"Terrible 
Some one broke my side window of my car and stole my wife purse 
Be carful there",https://www.yelp.com/biz/vista-hermosa-natural-park-los-angeles?adjust_creative=oAYGHKSZvK_Az-ZQ4UyTGQ&hrid=Jp8Cdt6SkIZz0z_qof858Q&utm_campaign=yelp_api_v3&utm_medium=api_v3_business_reviews&utm_source=oAYGHKSZvK_Az-ZQ4UyTGQ,YZ1rkKL6B8HtMJ0QfcWAOA,park,Vista Hermosa Natural Park,yelp,01-31-2020
2,D71SVQE4njU4nN43nZMXQA,4,This is a very nice park with lots of green space that's tucked away in DTLA. The navigation system led me to the entrance of the park opposite the parking...,https://www.yelp.com/biz/vista-hermosa-natural-park-los-angeles?adjust_creative=oAYGHKSZvK_Az-ZQ4UyTGQ&hrid=D71SVQE4njU4nN43nZMXQA&utm_campaign=yelp_api_v3&utm_medium=api_v3_business_reviews&utm_source=oAYGHKSZvK_Az-ZQ4UyTGQ,ro8FKgMu75rU7jftTo-0fg,park,Vista Hermosa Natural Park,yelp,01-31-2020
0,VE2rHB2ZXBICw30M4C77Gw,5,"We came to this park for Inglewood's very first City of the Champions 5K walk/run event.

On line the event was supposed to be from 7am til noon.  We...",https://www.yelp.com/biz/edward-vincent-jr-park-inglewood?adjust_creative=oAYGHKSZvK_Az-ZQ4UyTGQ&hrid=VE2rHB2ZXBICw30M4C77Gw&utm_campaign=yelp_api_v3&utm_medium=api_v3_business_reviews&utm_source=oAYGHKSZvK_Az-ZQ4UyTGQ,MqDgSw9wZFsaFFPRKh-k8A,park,Edward Vincent Jr Park,yelp,01-31-2020
1,_Fz0kEyaGhwrun_w-P2Ajw,4,"Edward Vincent Park has been the destination for family's and camps during the Summer. The pool facility in particular, a seasonal pool is equipped with two...",https://www.yelp.com/biz/edward-vincent-jr-park-inglewood?adjust_creative=oAYGHKSZvK_Az-ZQ4UyTGQ&hrid=_Fz0kEyaGhwrun_w-P2Ajw&utm_campaign=yelp_api_v3&utm_medium=api_v3_business_reviews&utm_source=oAYGHKSZvK_Az-ZQ4UyTGQ,i2Cx1lE0PRD_86Oh60hXbQ,park,Edward Vincent Jr Park,yelp,01-31-2020
2,qNKV3WYV9AuT0naAO7mugg,5,"Great place near West street . 3 mins drive and kids can have so much fun ! There are soccer and football games in the evening and weekend. 
You can also...",https://www.yelp.com/biz/edward-vincent-jr-park-inglewood?adjust_creative=oAYGHKSZvK_Az-ZQ4UyTGQ&hrid=qNKV3WYV9AuT0naAO7mugg&utm_campaign=yelp_api_v3&utm_medium=api_v3_business_reviews&utm_source=oAYGHKSZvK_Az-ZQ4UyTGQ,Z62EjnNaBjPsz4Gmbswf8g,park,Edward Vincent Jr Park,yelp,01-31-2020
0,9ECoRy1ZRFG3NewFe5LQ0g,5,"My favorite park in Los Angeles County. Spacious, has parking- cost during the week, clean and overall an amazing park.

Staff are on top of the cleanings...",https://www.yelp.com/biz/kenneth-hahn-state-recreation-area-los-angeles?adjust_creative=oAYGHKSZvK_Az-ZQ4UyTGQ&hrid=9ECoRy1ZRFG3NewFe5LQ0g&utm_campaign=yelp_api_v3&utm_medium=api_v3_business_reviews&utm_source=oAYGHKSZvK_Az-ZQ4UyTGQ,NIOdjbXg0bRItbpND_43KA,park,Kenneth Hahn State Recreation Area,yelp,01-31-2020
1,KN16eU6EuwGuzAzqtTPP2A,4,"If you're looking for a leisure hike with one of the best city view.  I definitely recommend this park. 

The trail starts near the park entrance.  There is...",https://www.yelp.com/biz/kenneth-hahn-state-recreation-area-los-angeles?adjust_creative=oAYGHKSZvK_Az-ZQ4UyTGQ&hrid=KN16eU6EuwGuzAzqtTPP2A&utm_campaign=yelp_api_v3&utm_medium=api_v3_business_reviews&utm_source=oAYGHKSZvK_Az-ZQ4UyTGQ,kJjdLLmf9hDr1Ww8hayGig,park,Kenneth Hahn State Recreation Area,yelp,01-31-2020
2,egto0m13wmthrqcWg9Uqrg,3,"An outdoor oasis in the urban landscape of LA Metro. Not a bad escape for a nice walk and some fresh air away from the traffic clogged streets.

Some nice...",https://www.yelp.com/biz/kenneth-hahn-state-recreation-area-los-angeles?adjust_creative=oAYGHKSZvK_Az-ZQ4UyTGQ&hrid=egto0m13wmthrqcWg9Uqrg&utm_campaign=yelp_api_v3&utm_medium=api_v3_business_reviews&utm_source=oAYGHKSZvK_Az-ZQ4UyTGQ,J6jwGkNkts0YfTuB7aMmow,park,Kenneth Hahn State Recreation Area,yelp,01-31-2020
0,U0wnmujUszMU4Y-lBeGz5g,5,"what a lovely little spot.  nice and clean with turtles you can touch. not a big park but really pretty, and clean.  except for all the bird crap.",https://www.yelp.com/biz/polliwog-park-manhattan-beach?adjust_creative=oAYGHKSZvK_Az-ZQ4UyTGQ&hrid=U0wnmujUszMU4Y-lBeGz5g&utm_campaign=yelp_api_v3&utm_medium=api_v3_business_reviews&utm_source=oAYGHKSZvK_Az-ZQ4UyTGQ,Hm7kGsruVDuW-EPsDQ8dyA,park,Polliwog Park,yelp,01-31-2020
1,N8-aQiTMhyufVlgDb6GPaw,5,"5 stars allllll the way!! 
They now added a fitness station for adults with machines right next to the slides and playground for the kids. 
 
When I was a...",https://www.yelp.com/biz/polliwog-park-manhattan-beach?adjust_creative=oAYGHKSZvK_Az-ZQ4UyTGQ&hrid=N8-aQiTMhyufVlgDb6GPaw&utm_campaign=yelp_api_v3&utm_medium=api_v3_business_reviews&utm_source=oAYGHKSZvK_Az-ZQ4UyTGQ,QtT8tBXKhZI3Ehe4oUfbGw,park,Polliwog Park,yelp,01-31-2020
2,Fo_gFW2Na8N5bXFr9_MW_w,5,"Updating my review from four years ago!

Now that I have I son we love coming to this park. I even rented out the gazebo by the pond for his first birthday....",https://www.yelp.com/biz/polliwog-park-manhattan-beach?adjust_creative=oAYGHKSZvK_Az-ZQ4UyTGQ&hrid=Fo_gFW2Na8N5bXFr9_MW_w&utm_campaign=yelp_api_v3&utm_medium=api_v3_business_reviews&utm_source=oAYGHKSZvK_Az-ZQ4UyTGQ,Ba_cWbzh2Wghm9runQ0WUQ,park,Polliwog Park,yelp,01-31-2020
